{"$schema":"https://json-schema.org/draft/2020-12/schema","$id":"urn:open-brain:portable-brain:v1:action","type":"object","properties":{"action_id":{"$ref":"urn:open-brain:portable-brain:v1:common#/$defs/action_id"},"action_request":{"type":"object","minProperties":1},"action_request_sha256":{"$ref":"urn:open-brain:portable-brain:v1:common#/$defs/digest"},"action_result":{"type":"object","minProperties":1},"action_result_sha256":{"$ref":"urn:open-brain:portable-brain:v1:common#/$defs/digest"},"actor_id":{"$ref":"urn:open-brain:portable-brain:v1:common#/$defs/actor_id"},"approval_receipt":{"$ref":"urn:open-brain:portable-brain:v1:common#/$defs/receipt"},"decision_id":{"$ref":"urn:open-brain:portable-brain:v1:common#/$defs/decision_id"},"outcome":{"enum":["completed","not_executed","failed"]},"proposal_id":{"$ref":"urn:open-brain:portable-brain:v1:common#/$defs/proposal_id"},"recorded_at":{"$ref":"urn:open-brain:portable-brain:v1:common#/$defs/timestamp"},"role_claim":{"$ref":"urn:open-brain:portable-brain:v1:common#/$defs/role_claim"},"schema_version":{"const":1},"tenant_id":{"$ref":"urn:open-brain:portable-brain:v1:common#/$defs/tenant_id"}},"required":["action_id","action_request","action_request_sha256","action_result","action_result_sha256","actor_id","approval_receipt","decision_id","outcome","proposal_id","recorded_at","role_claim","schema_version","tenant_id"],"additionalProperties":false}
