{"action_id":"action_123e4567-e89b-42d3-a456-42661417400b","action_request":{"kind":"external_message","target":"https://example.invalid/action"},"action_request_sha256":"b1e05553e226b8ca75279980b3e6074ffa90c476c4058215f8d047e56716398c","action_result":{"status":"not_sent"},"action_result_sha256":"286f880391b5600344283f62017ebbecb49ac45b19fa1ab5e907aebf06c28de1","actor_id":"actor_123e4567-e89b-42d3-a456-426614174001","approval_receipt":{"kind":"external_action","payload":{"action_id":"action_123e4567-e89b-42d3-a456-42661417400b","action_request_sha256":"b1e05553e226b8ca75279980b3e6074ffa90c476c4058215f8d047e56716398c","decision_id":"decision_123e4567-e89b-42d3-a456-426614174019"},"receipt_id":"receipt_123e4567-e89b-42d3-a456-426614174130","recorded_at":"2026-08-30T12:00:00Z","sha256":"cc309343a3980644bc0d7ec48e805e4a0516c04c56da21ec7435277fc99b7684","subject_id":"action_123e4567-e89b-42d3-a456-42661417400b"},"decision_id":"decision_123e4567-e89b-42d3-a456-426614174019","outcome":"not_executed","proposal_id":"proposal_123e4567-e89b-42d3-a456-426614174018","recorded_at":"2026-08-30T12:11:00Z","role_claim":{"actor_id":"actor_123e4567-e89b-42d3-a456-426614174001","capabilities":["capture.accept","space.write"],"role_claim_id":"role_claim_123e4567-e89b-42d3-a456-426614174003","role_id":"role_123e4567-e89b-42d3-a456-426614174002","tenant_id":"tenant_123e4567-e89b-42d3-a456-426614174000"},"schema_version":1,"tenant_id":"tenant_123e4567-e89b-42d3-a456-426614174000"}